StartDate,EndDate,Status,IPAddress,Progress,Duration (in seconds),Finished,RecordedDate,ResponseId,RecipientLastName,RecipientFirstName,RecipientEmail,ExternalReference,LocationLatitude,LocationLongitude,DistributionChannel,UserLanguage,Q_RecaptchaScore,EventName,QID16,QID20,QID19,Location
2024 02 20 09:30:00 06:00,2024 02 20 11:00:00 06:00,,,100,,True,2024 12 11 15:50:33+00:00,040000008200E00074C5B7101A82E0080000000080D4174CFB5BDA01000000000000000010000000DCAE438E28019C4C9B1404110C479B44,,,,,,,,,,St. Theresa's Lego Microgame Visit ,,, ,
2024 04 19 10:00:00 05:00,2024 04 19 10:45:00 05:00,,,100,,True,2024 12 11 15:50:33+00:00,040000008200E00074C5B7101A82E0080000000060B485CEE421DA010000000000000000100000003500808F814F244298E48E944290CAAF,,,,,,,,,,"Spring Insider Academy  Rotation 1, SHSS / Conservatory ",,,This group will likely roll in around 10:20  ________________________________ From: Addington  Nathaniel Sent: Tuesday  November 28  2023 10:23:30 AM (UTC 06:00) Central Time (US & Canada) To: Addington  Nathaniel <naddington@umkc.edu>; Falicov  Tamara <tfalicov@umkc.edu>; Crappell  Courtney <courtneycrappell@umkc.edu>; Thurmaier  David P. <thurmaierd@umkc.edu>; Snell  James <SnellJa@umkc.edu>; Hiett  DeeAnna L. <hiettd@umkc.edu>; Robertson  Amy <robertsonam@umkc.edu>; Roberts  Stephanie R. <robertssr@umkc.edu>; Constantino  Joselito A. <constantinoj@umkc.edu>; Lillebo  Troy <lillebot@umkc.edu>; Crespino  Curtis J. <CrespinoCJ@umkc.edu>; Rupp  Laura <ruppl@umkc.edu>; Skluzacek  Laura <skluzacekl@umkc.edu>; Samaripa  Amy <loughmana@umkc.edu>; Hayes  Christopher <christopherhayes@umkc.edu>; Mcwilliams  Brandon <brmcwilliams@umkc.edu> Cc: Hohenstein Flack  Hannah <hohensteinflackh@umkc.edu>; Burrus  Jennifer Parker <burrusjen@umkc.edu>; Thomas  Elora <elora.thomas@umkc.edu>; Doucet  Shelly <doucets@umkcfoundation.org> Subject: Spring Insider Academy  Rotation 1  SHSS / Conservatory When: Friday  April 19  2024 10:00 AM 10:45 AM. Where: PAC / Fine Arts  All  please share this invitation with others in your respective units who will be participating. I’ll be sharing your list participants in the coming weeks. ,PAC / Fine Arts
2024 04 19 11:30:00 05:00,2024 04 19 12:15:00 05:00,,,100,,True,2024 12 11 15:50:33+00:00,040000008200E00074C5B7101A82E0080000000040382EF0EA79DA0100000000000000001000000092753CF0C665054EB01F0362121B3127,,,,,,,,,,"Spring Insider Academy  Rotation 2, Bloch / SSE ",,, ________________________________ From: Addington  Nathaniel Sent: Tuesday  March 19  2024 10:50:57 AM (UTC 06:00) Central Time (US & Canada) To: Addington  Nathaniel <naddington@umkc.edu>; Lillebo  Troy <lillebot@umkc.edu>; Constantino  Joselito A. <constantinoj@umkc.edu>; Samaripa  Amy <loughmana@umkc.edu>; Rupp  Laura <ruppl@umkc.edu>; Skluzacek  Laura <skluzacekl@umkc.edu>; Truman  Kevin Z. <trumank@umkc.edu>; Brian Klaas <klaasb@umkc.edu>; Davis  Christina S. <davischristina@umkc.edu>; Eichenseer  Michael D. <mdezqd@umkc.edu>; Abdulrahim  Mujahid <mujahid.abdulrahim@umkc.edu>; Matlack  Alexandria <matlacka@umkc.edu>; Williams  Benjamin J. <williamsbenj@umkc.edu>; Innovationstudio <innovationstudio@umkc.edu>; Kanoy  Brian <bkanoy@umkc.edu> Cc: Thomas  Elora <elora.thomas@umkc.edu>; Doucet  Shelly <doucets@umkcfoundation.org> Subject: Spring Insider Academy  Rotation 2  Bloch / SSE When: Friday  April 19  2024 11:30 AM 12:15 PM. Where: Bloch Executive / Plaster Center   ,Bloch Executive / Plaster Center
2024 06 17 11:00:00 05:00,2024 06 17 11:30:00 05:00,,,100,,True,2024 12 11 15:50:33+00:00,040000008200E00074C5B7101A82E0080000000050C1A37DADC0DA0100000000000000001000000033B7094190586A4B8190DBAB111BABB6,,,,,,,,,,Are you ready for the summer camp?,,,  _____________________________________________ From: Usher  Sailor (UMKC Student) <susher@mail.umkc.edu> Sent: Monday  June 17  2024 9:39 AM To: Ding  Huan <dingh@umkc.edu> Subject: Re: Are you ready for the summer camp?  Tomorrow works for me. I'll be here from 9:00am to 5:00pm. ________________________________ From: Ding  Huan <dingh@umkc.edu<mailto:dingh@umkc.edu>> Sent: Monday  June 17  2024 9:25 AM To: Usher  Sailor (UMKC Student) <susher@mail.umkc.edu<mailto:susher@mail.umkc.edu>> Subject: RE: Are you ready for the summer camp?   How about this afternoon? If not  tomorrow works better for me to meet in person.  Or I can meet online today at 11:00am.    From: Usher  Sailor (UMKC Student) <susher@mail.umkc.edu<mailto:susher@mail.umkc.edu>> Sent: Monday  June 17  2024 8:51 AM To: Ding  Huan <dingh@umkc.edu<mailto:dingh@umkc.edu>> Subject: Re: Are you ready for the summer camp?    Hi Huan     Here is a link<https://nam02.safelinks.protection.outlook.com/?url=https:%2F%2Fdrive.google.com%2Fdrive%2Ffolders%2F1HLD5VS2CU2z6nu5AeI P_Q6f T woNQe%3Fusp%3Dsharing&data=05%7C02%7Csusher%40mail.umkc.edu%7C65b26879c7a340205c7408dc8eee8a1e%7Ce3fefdbef7e9401ba51a355e01b05a89%7C0%7C0%7C638542402380033349%7CUnknown%7CTWFpbGZsb3d8eyJWIjoiMC4wLjAwMDAiLCJQIjoiV2luMzIiLCJBTiI6Ik1haWwiLCJXVCI6Mn0%3D%7C0%7C%7C%7C&sdata=WNNJ3djUrQ0IZ5VWSkoSN4DNnXkPeFSBEy3nE8JeV7E%3D&reserved=0> to my Google Drive folder with everything for the camp.    11:00am today works for me  I will be in the VR Lab if you want to meet in person.  Best regards   J. Sailor Usher  ________________________________  From: Ding  Huan <dingh@umkc.edu<mailto:dingh@umkc.edu>> Sent: Friday  June 14  2024 2:24 PM To: Usher  Sailor (UMKC Student) <susher@mail.umkc.edu<mailto:susher@mail.umkc.edu>> Subject: Are you ready for the summer camp?    Hi Sailor   Congratulations! Are you ready for the summer camp?  Do you want to catch up in the morning on Monday? I will be available at 11:00am on Monday.  Let me know if you want to go over everything again on Monday in person or online.  Best   Huan ,VR lab
2024 06 19,2024 06 29,,,100,,True,2024 12 11 15:50:33+00:00,040000008200E00074C5B7101A82E00800000000E0BE59E61BA6DA01000000000000000010000000DEA6D61C90F47245A35CD3DB634058CD,,,,,,,,,,Hongkong High School Program DATE HOLD,,,Hi Sailor  I am holding your calendar for Hongkong Summer program. This doesn’t mean you need to be here the entire time. Our program partner  who is copied in this email  will send you detail outlook invitation with zoom link/location for your sessions. Thank you. Best  Huan ,Online and In person
2024 06 19 07:30:00 05:00,2024 06 19 08:30:00 05:00,,,100,,True,2024 12 11 15:50:33+00:00,17214B5D 99D2 44FE BDB3 44DCBF6A1C7A,,,,,,,,,,Introduction of VR and AR,,,WARNING: This message has originated from an External Source. This may be a phishing expedition that can result in unauthorized access to our IT System. Please use proper judgment and caution when opening attachments  clicking links  or responding to this email. Dear Mr. Sailor   This is Tian  the international program manager of this Hong Kong High School Program.  We are so glad to have you again and as the high school program VR session Instructor to give our Hong Kong High school students your first 1 hour session of Introduction of VR and AR.  Students loved you very much for our last year program and they all learned a lot from you. We believe students could make a big achievement this year by exploring the VR&AR world with you together!  Looking forward to seeing you soon!   Topic: Introduction of VR and AR  Time: Wednesday  June 19  2024 7:30am 8:30am KC Time              Wednesday  June 19  2024 8:30pm 9:30pm HK Time Meeting ID: 411 123 2454 Passcode: 24UMKCSP Zoom Link: https://us06web.zoom.us/j/4111232454?pwd=Qq3mM1yEoi21riT5x48gMpbicbAFYd.1  Best  Tian   ,Zoom
2024 06 20 08:30:00 05:00,2024 06 20 09:00:00 05:00,,,100,,True,2024 12 11 15:50:33+00:00,3242E9DF 963E 4E85 8718 D3FCBA67EAC8,,,,,,,,,,VR Tools and pre study,,,WARNING: This message has originated from an External Source. This may be a phishing expedition that can result in unauthorized access to our IT System. Please use proper judgment and caution when opening attachments  clicking links  or responding to this email. Dear Mr. Sailor   This session is your second online session to give the 30mins speech of VR Tools and pre study to our Hong Kong High School students.   Topic: VR Tools and pre study  Time: Thursday  June 20  2024 8:30am 9:00am KC Time              Thursday  June 20  2024 9:30pm 10:00pm HK Time Meeting ID: 411 123 2454 Passcode: 24UMKCSP Zoom Link: https://us06web.zoom.us/j/4111232454?pwd=Qq3mM1yEoi21riT5x48gMpbicbAFYd.1  Best  Tian  ,Zoom
2024 06 24 08:50:00 05:00,2024 06 24 09:50:00 05:00,,,100,,True,2024 12 11 15:50:33+00:00,040000008200E00074C5B7101A82E0080000000090D845AB5EC5DA01000000000000000010000000D1C23265FB5948408283ABCF26F06F70,,,,,,,,,,Welcome HK Students,,,Hi Christina  Hope your day is going well! I will pick up the vice principal from the hotel near airport at 8:30am in the morning. Would you mind opening the classroom at P204 around 8:50am? And welcome the group at 9:10am? Can the group have two cards to open the room P204 for the entire next week so that they can get in and out by themselves? Thank you so much!!!! See you on Monday. Best  Huan  ,P204
2024 06 24 14:00:00 05:00,2024 06 24 15:00:00 05:00,,,100,,True,2024 12 11 15:50:33+00:00,AF2D58BD F013 4827 A9C6 46990408FECE,,,,,,,,,,Explore the games and devices at AVR Lab,,,WARNING: This message has originated from an External Source. This may be a phishing expedition that can result in unauthorized access to our IT System. Please use proper judgment and caution when opening attachments  clicking links  or responding to this email. Dear Mr. Sailor    Here is the class information of today’s session of 2024 HK High School Summer Program    Time: Monday  June 24  2024 2:00pm   3:00pm  Location: AVR Lab  Topic: Meta world: Explore the games and devices at AVR Lab    *   Students will walk around the lab and be introduced to all the devices   *   Students will be in different groups to play VR games (4 Oculus Quests and 1 Apple Vision Pro are required )  Best  Tian ,AVR Lab
2024 06 24 15:30:00 05:00,2024 06 24 16:30:00 05:00,,,100,,True,2024 12 11 15:50:33+00:00,E2CD5EEA 3C46 44C2 9327 24B3CECFDC4B,,,,,,,,,,VR Unity Project “Build the research lab” ,,,WARNING: This message has originated from an External Source. This may be a phishing expedition that can result in unauthorized access to our IT System. Please use proper judgment and caution when opening attachments  clicking links  or responding to this email. Dear Mr. Sailor   Here is the class information of today’s session of 2024 HK High School Summer Program  Time: Monday  June 24  2024 3:30pm   4:30pm Location: P204  Topic: VR Unity Project “Build the research lab”    *   Test the students’ homework  check what they have learned   *   Scan the environment with your phone or Apple Vision pro   *   Test the environment  Best  Tian  ,P204
2024 06 25 13:30:00 05:00,2024 06 25 14:30:00 05:00,,,100,,True,2024 12 11 15:50:33+00:00,B6B62F6C D7AE 4A53 A83D 09D742655566,,,,,,,,,,Build environment and interactive game,,,WARNING: This message has originated from an External Source. This may be a phishing expedition that can result in unauthorized access to our IT System. Please use proper judgment and caution when opening attachments  clicking links  or responding to this email. Dear Mr. Sailor   Here is the class information of today’s session of 2024 HK High School Summer Program  Time: Tuesday  June 25  2024 1:30pm   2:30pm Location: P204  Topic: Build environment and interactive game    *   Students will keep works on the environment   *   Learn how to design an interactive game   *   Students will also work on their business ideas of building their product prototype  Best  Tian  ,P204
2024 06 26 14:00:00 05:00,2024 06 26 15:30:00 05:00,,,100,,True,2024 12 11 15:50:33+00:00,33EAB031 857F 45BD AD2B 548009FCB9CE,,,,,,,,,,VR project hands on ,,,WARNING: This message has originated from an External Source. This may be a phishing expedition that can result in unauthorized access to our IT System. Please use proper judgment and caution when opening attachments  clicking links  or responding to this email. Dear Mr. Sailor   Here is the class information of today’s session of 2024 HK High School Summer Program  Time: Wednesday  June 26  2024 2:00pm   3:30pm Location: P204  Topic: VR project hands on    *   Students keep works on building environment    *   Works on design interactive game   *   Building their product prototype  Best  Tian  ,P204
2024 06 27 10:00:00 05:00,2024 06 27 11:00:00 05:00,,,100,,True,2024 12 11 15:50:33+00:00,199BE8E6 6FC2 40D6 9D85 374116C5314E,,,,,,,,,,VR project hands on ,,,WARNING: This message has originated from an External Source. This may be a phishing expedition that can result in unauthorized access to our IT System. Please use proper judgment and caution when opening attachments  clicking links  or responding to this email. Dear Mr. Sailor   Here is the class information of today’s session of 2024 HK High School Summer Program  Time: Thursday  June 27  2024 10:00am   11:00am Location: P204  Topic: VR project hands on    *   Students keep works on building environment   *   Works on design interactive game   *   Building their product prototype  Best  Tian   ,P204
2024 06 28 18:00:00 05:00,2024 06 28 19:30:00 05:00,,,100,,True,2024 12 11 15:50:33+00:00,1E01E6D5 E02B 486B 9CBD C10B13CDC590,,,,,,,,,,2024 HK STEMSP graduation dinner,,,Hi Sailor and Ailing   I would like to invite you to join our graduation dinner together on Friday June 28 6:00pm 7:30pm  Best  Tian  ,Jack Stack Barbecue at plaza
2024 07 17 16:00:00+02:00,2024 07 17 16:30:00+02:00,,,100,,True,2024 12 11 15:50:33+00:00,040000008200E00074C5B7101A82E008000000007D8B8B4A13D8DA0100000000000000001000000087FE9EEB42FC10499AD09885213E6974,,,,,,,,,,Sailor videocall ,,,   ________________________________________________________________________________ Microsoft Teams Need help?<https://nam02.safelinks.protection.outlook.com/?url=https:%2F%2Faka.ms%2FJoinTeamsMeeting%3Fomkt%3Den US&data=05%7C02%7Cjsusher%40umkc.edu%7Caadb3134e5eb45a4b05b08dca62a7291%7Ce3fefdbef7e9401ba51a355e01b05a89%7C0%7C0%7C638567949491058517%7CUnknown%7CTWFpbGZsb3d8eyJWIjoiMC4wLjAwMDAiLCJQIjoiV2luMzIiLCJBTiI6Ik1haWwiLCJXVCI6Mn0%3D%7C60000%7C%7C%7C&sdata=ock8wiN7CUhverPMAoAmvnUhjNUOHlDDZTsyV0kVIRI%3D&reserved=0> Join the meeting now<https://nam02.safelinks.protection.outlook.com/ap/t 59584e83/?url=https:%2F%2Fteams.microsoft.com%2Fl%2Fmeetup join%2F19%253ameeting_ZTQyMzQ5ZTktOWMxNC00NDVlLTlmNDktOTQyMWRmNWNiNTJl%2540thread.v2%2F0%3Fcontext%3D%257b%2522Tid%2522%253a%252292fb83fa acc4 4429 aa8d 1df67c7ac7c7%2522%252c%2522Oid%2522%253a%2522d0699cfe f2aa 4644 b8bd 9f21cbb3a101%2522%257d&data=05%7C02%7Cjsusher%40umkc.edu%7Caadb3134e5eb45a4b05b08dca62a7291%7Ce3fefdbef7e9401ba51a355e01b05a89%7C0%7C0%7C638567949491069435%7CUnknown%7CTWFpbGZsb3d8eyJWIjoiMC4wLjAwMDAiLCJQIjoiV2luMzIiLCJBTiI6Ik1haWwiLCJXVCI6Mn0%3D%7C60000%7C%7C%7C&sdata=uBAhesetS4tVzJOYqUJAC4JCBPgsVhHFko30aAn1Kxg%3D&reserved=0> Meeting ID: 340 914 026 981 Passcode: Wtch6r ________________________________ For organizers: Meeting options<https://nam02.safelinks.protection.outlook.com/?url=https:%2F%2Fteams.microsoft.com%2FmeetingOptions%2F%3ForganizerId%3Dd0699cfe f2aa 4644 b8bd 9f21cbb3a101%26tenantId%3D92fb83fa acc4 4429 aa8d 1df67c7ac7c7%26threadId%3D19_meeting_ZTQyMzQ5ZTktOWMxNC00NDVlLTlmNDktOTQyMWRmNWNiNTJl%40thread.v2%26messageId%3D0%26language%3Den US&data=05%7C02%7Cjsusher%40umkc.edu%7Caadb3134e5eb45a4b05b08dca62a7291%7Ce3fefdbef7e9401ba51a355e01b05a89%7C0%7C0%7C638567949491077831%7CUnknown%7CTWFpbGZsb3d8eyJWIjoiMC4wLjAwMDAiLCJQIjoiV2luMzIiLCJBTiI6Ik1haWwiLCJXVCI6Mn0%3D%7C60000%7C%7C%7C&sdata=%2F6t0Lm%2BM8BR2fZRksza8BJRfk0RynJfB%2Fku48VmQjsQ%3D&reserved=0> ________________________________________________________________________________ Yaw VR Virtual Reality Motion Simulator yawvr.com<https://nam02.safelinks.protection.outlook.com/?url=http:%2F%2Fyawvr.com%2F&data=05%7C02%7Cjsusher%40umkc.edu%7Caadb3134e5eb45a4b05b08dca62a7291%7Ce3fefdbef7e9401ba51a355e01b05a89%7C0%7C0%7C638567949491085576%7CUnknown%7CTWFpbGZsb3d8eyJWIjoiMC4wLjAwMDAiLCJQIjoiV2luMzIiLCJBTiI6Ik1haWwiLCJXVCI6Mn0%3D%7C60000%7C%7C%7C&sdata=vrFlGpqbRUOJgjxq2tnTyCG2VdLf4LoiY9syMq6SpT4%3D&reserved=0>  ,Microsoft Teams Meeting
2024 07 17 09:00:00 05:00,2024 07 17 10:00:00 05:00,,,100,,True,2024 12 11 15:50:33+00:00,040000008200E00074C5B7101A82E0080000000076C349C98ED7DA010000000000000000100000004B9D7FCAE4E8F14C8C168BE2AC35A2A8,,,,,,,,,,YawII Technician Video Call,,, ,
2024 07 23 13:00:00 05:00,2024 07 23 14:00:00 05:00,,,100,,True,2024 12 11 15:50:33+00:00,040000008200E00074C5B7101A82E0080000000050557AAE96D7DA0100000000000000001000000054EAEB930B9F874B8BE86084225ABAD2,,,,,,,,,,UMKC Communication and Journalism/VR showroom,,, ,Plaster VR showroom (2nd floor)
2024 07 24 10:00:00 05:00,2024 07 24 11:30:00 05:00,,,100,,True,2024 12 11 15:50:33+00:00,040000008200E00074C5B7101A82E0080000000030B80410D6D2DA01000000000000000010000000EBDF7F91FF819047A8CA9686A3E63C57,,,,,,,,,,JCCC tour of VR/3d printing/fabrication space at UMKC,,,Park in the blue 32S Rockhill Garage and proceed directly north to Flarsheim Hall. We will meet on the 5th floor in room 534 (Dean’s office area). Campus map: https://www.umkc.edu/about/documents/umkc volker campus map 0823.pdf  You will receive a parking pass to print and put on your dash in a separate email. If you do not receive it  check your spam folder. It frequently lands there. If you still do not receive it  go ahead and park in the garage and if there is a ticket we will take care of it.  ,UMKC Innovation Studio
2024 07 24 14:00:00 05:00,2024 07 24 15:30:00 05:00,,,100,,True,2024 12 11 15:50:33+00:00,040000008200E00074C5B7101A82E00800000000F9B8F10B94DEDA01000000000000000010000000F5C42251133D4640A9AC266253D2BD85,,,,,,,,,,Meeting with Horace from The Phoenix Collective,,, ,UMKC Plaster P201
2024 07 25 15:00:00+02:00,2024 07 25 15:30:00+02:00,,,100,,True,2024 12 11 15:50:33+00:00,040000008200E00074C5B7101A82E008000000005C16F6B13ADCDA0100000000000000001000000017D092624E708A4DABE3620138ACCBE4,,,,,,,,,,Sailor meeting,,,   ________________________________________________________________________________ Microsoft Teams Need help?<https://nam02.safelinks.protection.outlook.com/?url=https:%2F%2Faka.ms%2FJoinTeamsMeeting%3Fomkt%3Den US&data=05%7C02%7Cjsusher%40umkc.edu%7Cdda22c3f639847cfe2ba08dcaa51dca5%7Ce3fefdbef7e9401ba51a355e01b05a89%7C0%7C0%7C638572515778596746%7CUnknown%7CTWFpbGZsb3d8eyJWIjoiMC4wLjAwMDAiLCJQIjoiV2luMzIiLCJBTiI6Ik1haWwiLCJXVCI6Mn0%3D%7C0%7C%7C%7C&sdata=IYThkfgvdHKNEHv1ty%2FwwPXnLweTO6apIgg7TLJpDvY%3D&reserved=0> Join the meeting now<https://nam02.safelinks.protection.outlook.com/ap/t 59584e83/?url=https:%2F%2Fteams.microsoft.com%2Fl%2Fmeetup join%2F19%253ameeting_MDlhZjEyZGUtNzQwNS00ZThkLWI0YmYtMjQyN2ZmNDlkMmU3%2540thread.v2%2F0%3Fcontext%3D%257b%2522Tid%2522%253a%252292fb83fa acc4 4429 aa8d 1df67c7ac7c7%2522%252c%2522Oid%2522%253a%2522d0699cfe f2aa 4644 b8bd 9f21cbb3a101%2522%257d&data=05%7C02%7Cjsusher%40umkc.edu%7Cdda22c3f639847cfe2ba08dcaa51dca5%7Ce3fefdbef7e9401ba51a355e01b05a89%7C0%7C0%7C638572515778608004%7CUnknown%7CTWFpbGZsb3d8eyJWIjoiMC4wLjAwMDAiLCJQIjoiV2luMzIiLCJBTiI6Ik1haWwiLCJXVCI6Mn0%3D%7C0%7C%7C%7C&sdata=VRt6WWz2Lu3MD7AZUGLqEi6EQpYBW%2BhokFw0tLPT6pk%3D&reserved=0> Meeting ID: 319 956 261 349 Passcode: pUrAJp ________________________________ For organizers: Meeting options<https://nam02.safelinks.protection.outlook.com/?url=https:%2F%2Fteams.microsoft.com%2FmeetingOptions%2F%3ForganizerId%3Dd0699cfe f2aa 4644 b8bd 9f21cbb3a101%26tenantId%3D92fb83fa acc4 4429 aa8d 1df67c7ac7c7%26threadId%3D19_meeting_MDlhZjEyZGUtNzQwNS00ZThkLWI0YmYtMjQyN2ZmNDlkMmU3%40thread.v2%26messageId%3D0%26language%3Den US&data=05%7C02%7Cjsusher%40umkc.edu%7Cdda22c3f639847cfe2ba08dcaa51dca5%7Ce3fefdbef7e9401ba51a355e01b05a89%7C0%7C0%7C638572515778616735%7CUnknown%7CTWFpbGZsb3d8eyJWIjoiMC4wLjAwMDAiLCJQIjoiV2luMzIiLCJBTiI6Ik1haWwiLCJXVCI6Mn0%3D%7C0%7C%7C%7C&sdata=wYOgxfB3yHMIC%2B9lg2Fq%2F%2BAZg6uwadm0XzWvs1z2XV4%3D&reserved=0> ________________________________________________________________________________ Yaw VR Virtual Reality Motion Simulator yawvr.com<https://nam02.safelinks.protection.outlook.com/?url=http:%2F%2Fyawvr.com%2F&data=05%7C02%7Cjsusher%40umkc.edu%7Cdda22c3f639847cfe2ba08dcaa51dca5%7Ce3fefdbef7e9401ba51a355e01b05a89%7C0%7C0%7C638572515778624583%7CUnknown%7CTWFpbGZsb3d8eyJWIjoiMC4wLjAwMDAiLCJQIjoiV2luMzIiLCJBTiI6Ik1haWwiLCJXVCI6Mn0%3D%7C0%7C%7C%7C&sdata=E13PFdYIltmfjUHPoY0xReOqPss4skcs06LRy1wIOfw%3D&reserved=0>  ,Microsoft Teams Meeting
2024 07 26 15:00:00 05:00,2024 07 26 16:00:00 05:00,,,100,,True,2024 12 11 15:50:33+00:00,040000008200E00074C5B7101A82E0080000000002EB89B8A1DFDA01000000000000000010000000184BCE169F317E4C885DB2501B98984F,,,,,,,,,,Architecture students toured the AVR Showroom,,, ,
2024 07 29 15:00:00+02:00,2024 07 29 15:30:00+02:00,,,100,,True,2024 12 11 15:50:33+00:00,040000008200E00074C5B7101A82E00800000000F98B66C68AE1DA010000000000000000100000006349C36ACB0F5749B19A18CEC40E5B52,,,,,,,,,,Sailor videocall with Yaw,,,   ________________________________________________________________________________ Microsoft Teams Need help?<https://nam02.safelinks.protection.outlook.com/?url=https:%2F%2Faka.ms%2FJoinTeamsMeeting%3Fomkt%3Den US&data=05%7C02%7Cjsusher%40umkc.edu%7Cfd3cb3f628f74ef2d4a408dcafa1ecdd%7Ce3fefdbef7e9401ba51a355e01b05a89%7C0%7C0%7C638578357207898481%7CUnknown%7CTWFpbGZsb3d8eyJWIjoiMC4wLjAwMDAiLCJQIjoiV2luMzIiLCJBTiI6Ik1haWwiLCJXVCI6Mn0%3D%7C0%7C%7C%7C&sdata=GjfzZauXGvm6N8tnM3wrWS0a%2FI3raJjYhfyxcPy6wrM%3D&reserved=0> Join the meeting now<https://nam02.safelinks.protection.outlook.com/ap/t 59584e83/?url=https:%2F%2Fteams.microsoft.com%2Fl%2Fmeetup join%2F19%253ameeting_OTllN2NiMDUtMjM4Ni00ZDZkLWE5NjEtNzFlYTkzM2U1YWFl%2540thread.v2%2F0%3Fcontext%3D%257b%2522Tid%2522%253a%252292fb83fa acc4 4429 aa8d 1df67c7ac7c7%2522%252c%2522Oid%2522%253a%2522d0699cfe f2aa 4644 b8bd 9f21cbb3a101%2522%257d&data=05%7C02%7Cjsusher%40umkc.edu%7Cfd3cb3f628f74ef2d4a408dcafa1ecdd%7Ce3fefdbef7e9401ba51a355e01b05a89%7C0%7C0%7C638578357207911250%7CUnknown%7CTWFpbGZsb3d8eyJWIjoiMC4wLjAwMDAiLCJQIjoiV2luMzIiLCJBTiI6Ik1haWwiLCJXVCI6Mn0%3D%7C0%7C%7C%7C&sdata=FTR4EH4naYy6BQoYjAbsx7nff03TRgJt9I7Sd9hKJlk%3D&reserved=0> Meeting ID: 333 369 198 118 Passcode: 9SGGh3 ________________________________ For organizers: Meeting options<https://nam02.safelinks.protection.outlook.com/?url=https:%2F%2Fteams.microsoft.com%2FmeetingOptions%2F%3ForganizerId%3Dd0699cfe f2aa 4644 b8bd 9f21cbb3a101%26tenantId%3D92fb83fa acc4 4429 aa8d 1df67c7ac7c7%26threadId%3D19_meeting_OTllN2NiMDUtMjM4Ni00ZDZkLWE5NjEtNzFlYTkzM2U1YWFl%40thread.v2%26messageId%3D0%26language%3Den US&data=05%7C02%7Cjsusher%40umkc.edu%7Cfd3cb3f628f74ef2d4a408dcafa1ecdd%7Ce3fefdbef7e9401ba51a355e01b05a89%7C0%7C0%7C638578357207919297%7CUnknown%7CTWFpbGZsb3d8eyJWIjoiMC4wLjAwMDAiLCJQIjoiV2luMzIiLCJBTiI6Ik1haWwiLCJXVCI6Mn0%3D%7C0%7C%7C%7C&sdata=xo658tFFg%2BzGEp4O9zi2M2ZpPhgEqnIdefj2FLYEj%2Fs%3D&reserved=0> ________________________________________________________________________________ Yaw VR Virtual Reality Motion Simulator yawvr.com<https://nam02.safelinks.protection.outlook.com/?url=http:%2F%2Fyawvr.com%2F&data=05%7C02%7Cjsusher%40umkc.edu%7Cfd3cb3f628f74ef2d4a408dcafa1ecdd%7Ce3fefdbef7e9401ba51a355e01b05a89%7C0%7C0%7C638578357207926984%7CUnknown%7CTWFpbGZsb3d8eyJWIjoiMC4wLjAwMDAiLCJQIjoiV2luMzIiLCJBTiI6Ik1haWwiLCJXVCI6Mn0%3D%7C0%7C%7C%7C&sdata=1N8V207ho8D8NcpgC7mJTIVJZr5p7ihm2NwaonEK%2FFE%3D&reserved=0>  ,Microsoft Teams Meeting
2024 08 01 15:00:00 05:00,2024 08 01 16:30:00 05:00,,,100,,True,2024 12 11 15:50:33+00:00,040000008200E00074C5B7101A82E0080000000010AA7E67BEDDDA010000000000000000100000000D4FCA7833BB9245A9EECFB2E3356599,,,,,,,,,,SSE Plaster Tour and Training,,,The SSE recruiting staff would like to offer training and information about the Plaster Center if you are interested in learning more. While this tour doesn’t mean you will be asked to give tours of the space  it is often helpful to have some knowledge of what is available and what is told to prospective students. Those who attend will receive a script that we use with undergraduate prospective students and families. ,Meet in 336 Flarsheim
